product_id,description
1,"A stylish and modern wooden dining chair."
2,"A comfortable leather recliner perfect for lounging."
3,"An ergonomic desk chair with lumbar support."
4,"A stainless steel cooking pot with a non-stick coating."
5,"A set of eco-friendly bamboo kitchen utensils."
6,"A luxurious woolen blanket with elegant patterns."
7,"A durable and lightweight aluminum ladder."
8,"A powerful gaming desktop with RGB lighting."
9,"A compact portable air conditioner for small spaces."
10,"A multi-functional pressure cooker with safety features."
11,"A high-performance vacuum cleaner for carpets and floors."
12,"A sleek and modern glass coffee table for living rooms."
13,"A premium stainless steel water bottle with insulation."
14,"A foldable yoga mat made of eco-friendly materials."
15,"A wireless gaming mouse with customizable buttons."
16,"A large-capacity stainless steel dishwasher."
17,"A compact yet powerful microwave oven for quick meals."
18,"A waterproof Bluetooth speaker with excellent sound quality."
19,"A durable plastic storage box with locking lids."
20,"A high-resolution digital camera with interchangeable lenses."
21,"A modern LED desk lamp with adjustable brightness."
22,"A weather-resistant outdoor gazebo for gardens."
23,"A portable charcoal grill for outdoor barbecues."
24,"A stylish and energy-efficient ceiling fan."
25,"A durable and expandable garden hose with brass fittings."
26,"A classic wooden rocking chair for patios."
27,"A premium cotton bathrobe with soft texture."
28,"A smart home security camera with night vision."
29,"A large wall clock with a vintage design."
30,"A plush memory foam mattress for restful sleep."
31,"A fast-charging power bank with multiple USB ports."
32,"A lightweight and durable camping tent for two people."
33,"A 4K Ultra HD TV with built-in streaming apps."
34,"A high-speed blender with stainless steel blades."
35,"A classic wristwatch with a leather strap."
36,"A weatherproof outdoor solar light with motion detection."
37,"A sleek and modern bathroom vanity mirror with lights."
38,"A non-slip bathroom rug made of microfiber materials."
39,"A compact and foldable exercise bike for home workouts."
40,"A wireless noise-canceling headphone for travel."
41,"A set of decorative throw pillows with colorful patterns."
42,"A classic wooden jewelry box with a velvet lining."
43,"A sturdy wooden bookshelf with adjustable shelves."
44,"A high-efficiency washing machine with digital controls."
45,"A premium set of chef knives made of stainless steel."
46,"A soft and cozy cashmere scarf for winter."
47,"A robust gas-powered leaf blower for garden maintenance."
48,"A durable metal tool box with multiple compartments."
49,"A comfortable and lightweight pair of running shoes."
50,"A compact travel suitcase with 360-degree wheels."
51,"A water-resistant smartwatch with health monitoring."
52,"A set of premium silk pillowcases for better sleep."
53,"A stylish leather messenger bag for laptops."
54,"A high-capacity external hard drive with fast data transfer."
55,"A sleek stainless steel electric kettle with temperature control."
56,"A modern wooden TV stand with storage cabinets."
57,"A large-capacity refrigerator with smart controls."
58,"A premium car vacuum cleaner with powerful suction."
59,"A versatile cordless drill with a rechargeable battery."
60,"A stylish and durable leather wallet for men."
61,"A lightweight and portable laptop cooling pad."
62,"A luxury scented candle set with a variety of aromas."
63,"A comfortable memory foam neck pillow for travel."
64,"A spacious wooden wardrobe with sliding doors."
65,"A modern gas stove with an automatic ignition system."
66,"A high-performance desktop computer for video editing."
67,"A sturdy metal bed frame with a minimalist design."
68,"A weatherproof outdoor hammock with a stand."
69,"A stylish coffee maker with advanced brewing features."
70,"A durable stainless steel ice cream scoop with a soft handle."
71,"A large picnic basket with insulated compartments."
72,"A premium wool carpet with intricate designs."
73,"A compact robotic vacuum cleaner for automated cleaning."
74,"A classic wooden dining table with a natural finish."
75,"A portable induction cooktop with touch controls."
76,"A durable stainless steel frying pan with a glass lid."
77,"A spacious camping backpack with multiple compartments."
78,"A decorative indoor plant in a ceramic pot."
79,"A classic hardcover notebook with premium paper."
80,"A waterproof action camera for outdoor adventures."
81,"A digital photo frame with Wi-Fi connectivity."
82,"A weatherproof outdoor fire pit for cold evenings."
83,"A multi-functional smartwatch with fitness tracking."
84,"A compact and portable sewing machine for home use."
85,"A stylish leather handbag for women."
86,"A luxurious silk bed sheet set with a satin finish."
87,"A durable car cover with UV protection."
88,"A high-capacity juicer with an anti-drip spout."
89,"A pair of binoculars with high-definition optics."
90,"A smart robot toy with interactive features."
91,"A premium wine rack made of oak wood."
92,"A lightweight trekking pole with adjustable height."
93,"A high-speed electric scooter for urban commutes."
94,"A classic porcelain tea set with floral patterns."
95,"A compact and efficient space heater for winter."
96,"A sturdy and modern metal filing cabinet with locks."
97,"A luxurious velvet sofa set for living rooms."
98,"A multi-purpose kitchen organizer for spices and jars."
99,"A weatherproof and UV-protected patio furniture set."
100,"A professional-grade tripod for cameras and phones."
